id,scenario,persona,additional_context,question,option_a,option_b,option_c,option_d,correct_answer,reasoning,menu_items_referenced,created_at,rating,feedback_notes
Q_20250722_145815_4607,Special Occasion Menu Suggestions,Sweet Tooth Guest,A guest is in town for a festival and asks for event-themed menu items.,"A guest celebrating at the festival is a self-proclaimed 'sweet tooth' and wants a dessert that incorporates festival flavors.  Considering their dietary preferences are unknown, which dessert option presents the lowest risk of allergen issues while still offering a unique and exciting experience?",Chill,Skyfall,Hive,Vitality,A,"The question focuses on minimizing allergen risk for an unknown guest while offering a unique, festival-themed dessert. Chill has no listed allergens, making it the safest option.  Skyfall, Hive, and Vitality all contain common allergens (dairy, egg, nuts, gluten, sesame).  The Yuzu Dragon Fruit and Coconut Pandan in Chill offer unique and potentially festive flavor profiles.","Chill, Skyfall, Hive, Vitality",2025-07-22 14:58:15,4,keep the reasoning short and to the point
Q_20250722_150349_3782,Dessert Ingredient Awareness,Experimental Foodie,A guest is writing a review and asks the staff to share fun facts about the menu.,"An experimental foodie guest asks about unique dessert ingredients.  Which response best highlights unusual elements from both the Fruitopia Pancakes and Seared Sonoma Foie Gras, catering to their interest?","The Fruitopia Pancakes feature a blood orange scented syrup and hazelnut crumble, while the Foie Gras is served with a surprising huckleberry gastrique and yuzu meringue.","Both desserts are rich and decadent, using classic combinations of fruits and nuts.","Both dishes contain nuts, so guests with allergies should be aware.","The pancakes are gluten-free, while the Foie Gras is not.",A,"The question tests the staff's ability to identify and articulate unique dessert ingredients to satisfy a curious guest. Option A directly addresses the prompt by highlighting the unusual flavor combinations in both dishes (blood orange, hazelnut, huckleberry, yuzu). Options B, C, and D are less relevant to the guest's inquiry about unique elements.","Fruitopia Pancakes, Seared Sonoma Foie Gras",2025-07-22 15:03:49,4,Reasoning should include respective dish name instead of 'Option A' etc
Q_20250722_151042_3365,Vegan Ingredient Awareness,Experimental Foodie,A vegetarian guest wants to know which items are strictly plant-based and how they are prepared.,"An experimental foodie guest, strictly vegetarian, wants a completely plant-based dinner option.  Which menu item offers the fewest potential allergens while still showcasing unique flavor combinations, and what is a key ingredient to highlight to emphasize its plant-based nature?",Crispy Tofu;  Highlight the Gochujang Crema for a unique flavor profile.,Azuki Edamame Burger; Highlight the Azuki bean burger as the star.,Roasted Cauliflower Steak; Highlight the Miso Cauliflower Puree for depth of flavor.,Wild Mushroom Wellington; This option is unsuitable due to egg and dairy.,B,"The question assesses knowledge of vegan ingredients and allergen awareness.  Option B, the Azuki Edamame Burger, is entirely plant-based and clearly highlights the vegan Azuki bean burger, while options A and C contain allergens. Option D contains egg and dairy, making it unsuitable. The question requires comparing multiple menu items and considering both allergens and unique selling points.","Crispy Tofu, Azuki Edamame Burger, Roasted Cauliflower Steak, Wild Mushroom Wellington",2025-07-22 15:10:42,4,Lengthy reasoning
Q_20250722_160739_4227,Daily restaurant operations and customer service,Restaurant staff member serving customers,Restaurant service and customer interaction guidelines,A customer with a nut allergy and a gluten intolerance wants to order brunch.  They are also avoiding dairy. Which of the following actions is MOST appropriate?,Inform the customer that only the Nori Vinegar Dusted Fries are safe options from the provided menu.,Advise the customer that none of the listed brunch options are suitable due to their allergies and intolerances and suggest alternatives not on the menu.,"Offer the Cashew Pea Bisque, assuring them it's safe despite the nut allergy because it's a dinner item and therefore separate preparation.","Suggest the Fruitopia Pancakes, but omit the hazelnut crumble and blood orange syrup, ensuring the kitchen avoids cross-contamination.",B,"The Fruitopia Pancakes contain nuts, gluten, and dairy, making them unsuitable.  The Cashew Pea Bisque contains nuts.  While the Nori Vinegar Dusted Fries are listed as dinner, they are not brunch and may not be suitable for customer preferences.  The safest course of action is to inform the customer of the limitations and offer alternatives not listed on the menu to ensure their safety and satisfaction.","Fruitopia Pancakes, Cashew Pea Bisque, Nori Vinegar Dusted Fries",2025-07-22 16:07:39,2,very basic question
Q_161302_945,Bar Menu Upselling,Pescatarian Diner,A first-time customer is curious about the origins and stories behind each menu item.,"A pescatarian first-time customer, intrigued by the stories behind your menu, asks about the 'Mary's Organic Chicken' and expresses disappointment that it's not seafood.  How do you best upsell a bar menu item to this guest, highlighting both their pescatarian preference and their interest in culinary narratives?","Suggest the 'Chicharron Chicken & Waffle' brunch item (even though it's not on the bar menu), explaining its unique preparation and the story behind the karaage technique, emphasizing its deliciousness as a possible exception to their pescatarian diet.","Apologize for the lack of seafood options and offer a simple alternative, like a house salad, without further explanation.","Directly recommend a cocktail from the bar menu, stating it's a popular choice and will complement the chicken dish if they choose to order it.","Explain in detail the sourcing of the chicken in 'Mary's Organic Chicken,' emphasizing its quality, hoping to entice them despite their dietary preference.",A,"Option A is the best upselling strategy because it addresses both the customer's dietary restriction and their interest in the story behind the dish.  While not strictly on the bar menu, cleverly addressing the 'Chicharron Chicken & Waffle' as a potential exception (and focusing on the story) is a more effective upsell than simply offering an alternative or a drink. Options B, C, and D fail to fully address the customer's specific needs and interests.","Mary's Organic Chicken, Chicharron Chicken & Waffle",16:13:02,4,Keep the question and reasoning brief
Q_161425_848,Tea Pairing Suggestions,Sweet & Savory Fan,A family is dining with young children and is looking for caffeine-free and sweet menu options.,"A family, including young children and parents who enjoy both sweet and savory flavors, is looking for caffeine-free tea pairings.  The children want something undeniably sweet, while the parents appreciate a more nuanced flavor profile. Which tea pairing best caters to this diverse group, considering the potential for a shared experience?","Caramelized Pear Tea with a light, buttery scone for the children and a savory cheese platter for the parents.",Matcha Tea with a selection of fruit tarts for everyone.,"Pacific Coast Mint Tea with a range of pastries, including both sweet and savory options.","A blend of Pacific Coast Mint Tea and Caramelized Pear Tea, served with a selection of fruit and small sandwiches.",A,"Option A best caters to the diverse needs of the family. The Caramelized Pear Tea offers a distinctly sweet and fruity experience perfect for the children.  The savory cheese platter complements the parents' desire for a more complex flavor profile, while avoiding caffeine. Options B and D offer caffeine, and Option C, while offering both sweet and savory, doesn't provide a clear and separate sweet option for the children.","Caramelized Pear Tea, Pacific Coast Mint Tea",16:14:25,5,Good
Q_161536_962,Special Dietary Guest Handling,Shellfish Allergy Guest,A vegetarian guest wants to know which items are strictly plant-based and how they are prepared.,"A guest with a severe shellfish allergy and a vegetarian companion arrive. The vegetarian guest wants to confirm the plant-based nature and preparation method of menu items, while you must ensure the shellfish-allergic guest's safety.  Which approach BEST handles both concerns simultaneously?","Confirm with the vegetarian guest that the Burdock Puree and Artichokes Cooked in Barigoule from Mary's Organic Chicken are plant-based, emphasizing their preparation separately from any shellfish-containing dishes.  Then, explicitly assure the shellfish-allergic guest that no cross-contamination is possible due to separate preparation areas and utensils.",Quickly point out the Burdock Puree and Artichokes Cooked in Barigoule as vegetarian options.  Inform the shellfish-allergic guest that the kitchen is 'generally careful' about avoiding cross-contamination.,"Recommend the Chicharron Chicken & Waffle as a safe option for both guests, ignoring the vegetarian's request for clarification on other items.",Inform both guests that the menu descriptions are insufficient and offer them a complimentary appetizer while you consult the chef about potential allergens and vegetarian options.,A,Option A directly addresses both concerns. It provides specific details about the vegetarian options and explicitly assures the shellfish-allergic guest of safety through detailed explanations of kitchen procedures. Options B and D are insufficiently detailed and don't fully address the allergy concern. Option C ignores the vegetarian guest's needs.,"Mary's Organic Chicken, Chicharron Chicken & Waffle",16:15:36,4,Reasoning should contain the dish name instead of 'Option A'
Q_161626_810,Dessert Pairing,Sweet & Savory Fan,A guest is interested in seasonal specials and farm-to-table options.,"A guest, enthusiastic about both sweet and savory flavors and interested in seasonal, farm-to-table options, orders the Dungeness Crab Mac & Cheese.  They want a dessert pairing that complements the dish's richness and seafood element without being overly sweet. Which dessert (assuming availability) would be the BEST pairing, considering their preferences and the menu's focus?",A light lemon tart with a subtle sweetness and a hint of herbaceous notes.,A rich chocolate lava cake with raspberry coulis.,A classic crème brûlée with vanilla bean and caramelized sugar.,A decadent Key lime pie with a graham cracker crust.,A,"The lemon tart offers a refreshing counterpoint to the richness of the crab mac and cheese, while the herbaceous notes subtly complement the seafood. Options B, C, and D are too rich or sweet, potentially overwhelming the savory aspects of the main course and not aligning with the guest's desire for a balanced sweet and savory experience.","Dungeness Crab Mac & Cheese, Spring Vegetables",16:16:26,4,
Q_161922_199,Food Presentation Standards,Food Allergy Parent,A local food blogger is visiting to review the latest menu additions and seeks visually appealing plates.,"A food blogger with a child who has a soy allergy is reviewing your new menu.  They are impressed with the Umami Wagyu Beef Tartare but want to ensure all dishes are visually appealing and allergy-safe for photos and consumption. How should you present the Shimane Prefecture A5 Wagyu Beef to meet both the blogger's visual expectations and the child's allergy needs, considering the presence of soy in the Wagyu's preparation?","Present the Shimane Wagyu as a beautifully seared steak, garnished with a simple, allergy-safe reduction (e.g., balsamic glaze) and a microgreen salad.  Clearly indicate on the menu and verbally confirm that it's soy-free.","Serve the Shimane Wagyu in a traditional Japanese presentation with soy-based teriyaki sauce, but clearly label the soy content on a separate card.  This allows the blogger to photograph the dish without concerns.","Offer the Cap of Ribeye as a substitute, explaining that the Shimane Wagyu is prepared with soy. Ensure the Cap of Ribeye is plated attractively, perhaps with a flavorful herb butter and roasted vegetables.","Present the Shimane Wagyu as is, relying on the blogger to understand and manage the allergy themselves.  Focus on the quality of the Wagyu and assume the visual appeal is sufficient.",A,"Option A prioritizes both visual appeal and allergy safety.  A simple, elegant presentation avoids potential allergens while ensuring the dish looks appealing for photos. Options B and D risk the child's allergy; Option C is a viable alternative but doesn't directly address the question's focus on presenting the Shimane Wagyu.","Shimane Prefecture A5 Wagyu Beef, Umami Wagyu Beef Tartare",16:19:22,2,the reasoning should contain respective dish name instead of 'Option A'
Q_163135_145,Bar Menu Upselling,Seasonal Ingredient Seeker,A returning customer asks if there are any new menu items since their last visit.,"A returning customer, known for appreciating seasonal ingredients and unique flavor combinations, asks if there are any new additions to the bar menu since their last visit.  How do you best upsell them, highlighting the seasonal aspect and their past preferences?","Highlight the Wild Mushroom Wellington, emphasizing the variety of seasonal mushrooms and the unique umami-rich Mushroom Dashi, then suggest the Bone Marrow as a complementary side, mentioning the koji shiit fermentation for a complex flavor profile.","Recommend the Wild Mushroom Wellington, mentioning it's vegetarian. If they decline, offer a standard bar snack.","Suggest a beer pairing with the Bone Marrow, without mentioning the Wellington.",Simply state that there are no new items and offer the same drinks as last time.,A,"Option A directly addresses the customer's known preferences (seasonal ingredients, unique flavors) by highlighting the diverse seasonal mushrooms in the Wellington and the koji fermented Bone Marrow.  It also leverages the opportunity to upsell two items instead of one. Options B, C, and D fail to cater to the customer's known preferences or fully utilize the upselling opportunity.","Wild Mushroom Wellington, Bone Marrow",16:31:35,4,none
Q_163624_182,Special Occasion Menu Suggestions,No-Garlic Guest,A guest asks for small portions to try several things.,"A guest with a garlic allergy requests small portions of several items from the special occasion menu to sample various flavors. Which combination BEST accommodates their needs and preferences, considering their allergy and desire for variety?",A small portion of Mary's Organic Chicken and a small order of Chicharron Chicken & Waffle (without the sauce if it contains garlic).,A full portion of Mary's Organic Chicken.,Two full portions of Chicharron Chicken & Waffle.,A small portion of Mary's Organic Chicken and a large portion of Chicharron Chicken & Waffle.,A,"Option A is best because it offers variety in small portions, catering to the guest's request.  Mary's Organic Chicken is garlic-free, and we can modify the Chicharron Chicken & Waffle to exclude any potential garlic-containing sauces. Options B, C, and D don't consider the guest's allergy or their desire for small portions.","Mary's Organic Chicken, Chicharron Chicken & Waffle",16:36:24,5,
Q_163855_916,Ingredient Flavor Profiles,Seafood Aficionado,A returning customer asks if there are any new menu items since their last visit.,"A returning seafood aficionado asks about new menu items.  Considering their preferences and potential allergies (they have previously ordered dishes), which recommendation best highlights new flavors while mitigating potential allergen concerns?","The Fish Set, emphasizing the lemon-charred aspect and highlighting the absence of soy and dairy in its preparation.","The Fish Set, focusing on the black garlic puree and nori celery root puree, ignoring potential allergies.","The Spring Vegetables, emphasizing the miso celeriac puree as a unique flavor.",Suggest both the Fish Set and Spring Vegetables without addressing potential allergy concerns.,A,"The question tests the waitstaff's ability to cater to a returning customer's desire for novelty while considering potential allergies. Option A directly addresses the seafood aficionado's preference, highlights a new dish, and avoids mentioning potential allergens (soy, dairy, onion, garlic) present in other ingredients of the Fish Set. Options B and D fail to consider allergies, while Option C is less aligned with the customer's seafood preference.","Fish Set, Spring Vegetables",16:38:55,4,Keep the reasoning brief and to the point
Q_164023_718,Regional Cuisine Trivia,Mushroom Allergy Guest,A guest is writing a review and asks the staff to share fun facts about the menu.,"A guest with a mushroom allergy is writing a restaurant review and asks for fun facts about the menu.  Which response from the waitstaff is MOST appropriate, considering the guest's allergy and the menu?","“Our Wild Mushroom Wellington features four types of mushrooms – Brown Bunapi, White Bunapi, King Oyster, and Blue Oyster – all sautéed in coconut oil with shallots and braised daikon, then encased in puff pastry.  However, we also have the Bone Marrow, a side dish prepared with koji shiitaki mushrooms, that might be suitable for you.”",“Our Wild Mushroom Wellington is a vegetarian masterpiece! It's filled with delicious mushrooms and puff pastry.  Would you like to try our Bone Marrow instead?,“The Wild Mushroom Wellington is our signature dish.  It's very popular.”,“We have many delicious options;  I can help you find something else on the menu.”,A,"Option A is correct because it acknowledges the guest's allergy, provides details about the mushroom Wellington (relevant to the review request), and suggests an alternative dish (Bone Marrow) while noting the mushroom content of that alternative dish. Options B and C fail to fully address the allergy. Option D is too generic.","Wild Mushroom Wellington, Bone Marrow",16:40:23,4,The options contains unexpected texts such as '\u201cOur'
Q_164156_878,Dessert Allergy Awareness,Artistic Culinary Fan,A wine enthusiast asks for recommended pairings between teas and desserts for a high-end experience.,"An artistic culinary fan and wine enthusiast requests tea and dessert pairings, highlighting the absence of dairy, gluten, and egg.  Which pairing best caters to their preferences and avoids allergens, considering their appreciation for high-end experiences?","Chill (Yuzu Dragon Fruit, Coconut Pandan, Peach Champagne, Coconut Cream, Toasted Coconut, Marigold Flowers) paired with a delicate white tea.","Halo (Vanilla Tuile, Mango Curd, Pastry Cream, Passion Fruit Carmel, Mango Twirls, Coconut Twirls, Quenelle Coconut Ice Cream) paired with a robust black tea.",Skyfall (ingredients unspecified) paired with a herbal infusion.,"Chill paired with a robust black tea, and Halo paired with a delicate white tea.",A,"The question tests knowledge of both menu items and allergen awareness. Option A is correct because Chill is the only dessert listed that doesn't contain any of the specified allergens (gluten, dairy, egg).  Pairing it with a delicate white tea aligns with a high-end experience. Options B and D contain allergens; option C lacks sufficient information.","Chill, Halo",16:41:56,5,good
Q_164255_492,Mocktail Recommendations,Chocolate Aficionado,A guest is in town for a festival and asks for event-themed menu items.,"A chocolate-loving guest is in town for a festival and wants an event-themed mocktail.  Considering their preference and the dessert menu, which mocktail pairing would best complement their palate and the festive occasion?","Suggest a mocktail incorporating the Yuzu Dragon Fruit from the 'Chill' dessert, highlighting its unique flavor profile to create a refreshing and unexpected pairing.","Recommend a mocktail using the Mango Curd from the 'Halo' dessert, emphasizing its familiar sweetness to please the chocolate lover.","Suggest a mocktail based on the Passion Fruit Caramel from the 'Halo' dessert, focusing on its tangy notes to contrast with the chocolate.","Recommend a mocktail featuring the Coconut Pandan from the 'Chill' dessert, relying on its creamy texture to complement the richness of chocolate.",A,"The question tests the waitstaff's ability to connect a guest's preference (chocolate) with unexpected flavor pairings from the dessert menu and the festive context. Option A is best because Yuzu Dragon Fruit offers a unique, less predictable pairing that would be more memorable and exciting for a festival atmosphere than the more familiar Mango or Coconut flavors.","Chill, Halo",16:42:55,5,good
Q_164335_745,Dessert Ingredient Awareness,Sweet Tooth Guest,A guest wants to buy packaged teas or coffee beans to take home.,"A guest with a serious sweet tooth wants to purchase packaged tea to take home.  Considering their preference and the available options, which tea is the LEAST likely to satisfy them?",Pacific Coast Mint Tea,Matcha Tea,Caramelized Pear Tea,"None of the above, all teas would satisfy a sweet tooth",A,"The question assesses the waitstaff's ability to understand flavor profiles and match them to guest preferences. The Pacific Coast Mint Tea is described as 'Refreshing, Sharp, Smooth,' lacking the sweetness desired by the guest.  Matcha and Caramelized Pear Tea both offer flavors that align better with a sweet tooth. The guest's desire for packaged tea to take home is a detail to ensure the question is strictly relevant to the scenario.","Pacific Coast Mint Tea, Matcha Tea, Caramelized Pear Tea",16:43:35,3,question repeated
Q_164406_262,Ingredient Origin Storytelling,Mushroom Allergy Guest,A first-time customer is curious about the origins and stories behind each menu item.,"A first-time customer with a mushroom allergy is fascinated by the origin stories of your dishes and asks about the Wild Mushroom Wellington.  How should you best respond, considering their allergy and interest?","Explain the sourcing of the various mushrooms (Brown Bunapi, White Bunapi, King Oyster, Blue Oyster) and highlight the unique flavors they contribute, while clearly stating the dish is unsuitable due to their allergy and suggest the Bone Marrow with koji shiitaki as an alternative.","Focus solely on the puff pastry and egg yolk components, avoiding mention of the mushrooms to prevent upsetting the guest.","Offer a detailed explanation of the mushroom dashi and truffle powder, emphasizing their luxurious nature, and suggest a different vegetarian option without mentioning the allergy.",Apologize that you cannot accommodate their dietary needs and abruptly move on to other menu items.,A,"Option A directly addresses the guest's interest in origin stories while acknowledging and respecting their allergy.  It provides an alternative (Bone Marrow) and avoids triggering their allergy. Options B, C, and D are inadequate because they either ignore the allergy or fail to satisfy the guest's curiosity about the dish's origins.","Wild Mushroom Wellington, Bone Marrow",16:44:06,4,
Q_164445_701,Regional Cuisine Trivia,Dairy-Heavy Preference Guest,A couple on a first date seeks recommendations for shareable appetizers.,"A couple on their first date, with a strong dairy preference, wants shareable appetizers before ordering entrees. Considering their dairy preference and the potential for allergen cross-contamination, which appetizer strategy is BEST?","Suggest focusing on the Mary's Organic Chicken entree, emphasizing the unsalted butter and creamy jus, as a shareable dish, while carefully explaining potential egg cross-contamination risks.","Recommend the Chicharron Chicken & Waffle, highlighting the potential dairy in the karaage style preparation, disregarding the couple's date context.","Immediately recommend a side dish from the Mary's Organic Chicken entree, such as the Burdock Puree or Artichokes cooked in Barigoule, ignoring the shareable appetizer request.","Suggest sharing the Chicharron Chicken & Waffle and the Mary's Organic Chicken, despite the potential for multiple allergen cross-contaminations and ignoring the shareable appetizer request.",A,"The question tests the ability to prioritize guest preferences (dairy) within constraints (shareable appetizers, first date context, and allergen awareness). Option A directly addresses the dairy preference by focusing on the butter and jus in the entree, acknowledging the shareable nature and potential egg cross-contamination. Options B, C, and D either ignore crucial aspects of the scenario (shareable, first date, dairy focus) or introduce unnecessary risks (allergens).","Mary's Organic Chicken, Chicharron Chicken & Waffle",16:44:45,4,Keep reasoning brief
