id,scenario,persona,additional_context,question,option_a,option_b,option_c,option_d,correct_answer,reasoning,menu_items_referenced,created_at,rating,feedback_notes
Q_164647_934,Dessert Pairing,Shellfish Allergy Guest,A guest wants a recommendation for a “hidden gem” on the menu.,"A guest with a shellfish allergy seeks a 'hidden gem' dessert pairing for the Wild Mushroom Wellington.  Which option is the BEST recommendation, considering their allergy and the Wellington's ingredients?",No dessert pairing is recommended; the Wellington's ingredients present too many allergy risks.,"Recommend the Bone Marrow as a savory complement, emphasizing the koji shiit's unique flavor profile.","Suggest a fruit plate, clarifying it's free of common allergens, but mention it lacks a direct flavor connection to the Wellington.","Recommend a dairy-free sorbet, highlighting its refreshing contrast to the rich Wellington, while acknowledging potential cross-contamination risks.",A,"The question tests knowledge of allergen cross-contamination and menu limitations. The Wellington contains multiple allergens (gluten, egg, dairy, onion), making any pairing risky.  Option A is safest for the guest's shellfish allergy and avoids potential cross-contamination.","Wild Mushroom Wellington, Bone Marrow",16:46:47,5,Best
Q_164723_626,Seasonal Menu Items,Sweet & Savory Fan,A guest asks for a low-caffeine beverage that still feels indulgent.,"A guest who enjoys both sweet and savory flavors and prefers a low-caffeine beverage with an indulgent feel orders dessert.  Which dessert and beverage pairing best suits their preferences, considering their dietary restrictions are not specified?",Halo with a decaf herbal tea,Chill with decaf coffee,Skyfall with a glass of sparkling cider,Chill with a low-caffeine green tea,A,"The question focuses on a guest's preference for sweet and savory, and a low-caffeine indulgent beverage. The Halo dessert offers a complex flavor profile (mango, passion fruit, coconut) balancing sweet and tart notes.  A decaf herbal tea provides a sophisticated, non-caffeinated alternative to coffee, aligning with the 'indulgent feel' request. Other options either lack a clear sweet and savory balance or don't offer the low-caffeine aspect.","Halo, Chill",16:47:23,4,Keep reasoning brief
Q_164938_495,Dessert Pairing,Experimental Foodie,A guest is gluten-intolerant but wants to try a signature pastry—asks for alternatives.,"An experimental foodie with a gluten intolerance wants to enjoy a signature dessert.  Which alternative best satisfies their desire for a unique flavor profile similar to the Halo, while avoiding gluten?","Suggest the Chill, highlighting the unusual Yuzu Dragon Fruit and Coconut Pandan combination as a refreshing and equally adventurous alternative.","Recommend the Halo with a substitution of the vanilla tuile for a gluten-free alternative, if available.","Offer the Skyfall, explaining its unique flavor profile (information needed).",Inform them that no suitable gluten-free alternatives are available.,A,"The question tests knowledge of menu items and allergen information.  The Halo contains gluten; the Chill is gluten-free and offers a similarly experimental and unique flavor profile to appeal to the experimental foodie. Option B relies on availability of a gluten free alternative, not guaranteed. Option C lacks information about Skyfall.  Option D is incorrect as a suitable alternative exists.","Chill, Halo",16:49:38,4,good
Q_165011_241,Chef’s Special Knowledge,Shellfish Allergy Guest,A guest asks for the chef’s personal favorite menu item and why.,"A guest with a shellfish allergy asks for the chef's favorite menu item and the reason behind it.  Considering the chef's likely preferences and the guest's allergy, which response is MOST appropriate?",The chef's favorite is Mary's Organic Chicken because of the delicate balance of flavors and the high-quality ingredients.  It avoids common allergens.,"The chef loves the Chicharron Chicken & Waffle for its unique combination of textures and bold flavors, and highly recommends it.","The chef's personal favorite is the Mary's Organic Chicken, but it contains egg, so we would suggest an alternative.","I'm not sure what the chef's favorite is, but I can check with the kitchen.",C,The question tests knowledge of allergens and menu items. Option C is best because it acknowledges the guest's allergy and the chef's preference while offering a solution. Option A ignores the allergy. Option B doesn't consider the chef's potential preference for a dish without common allergens. Option D is insufficiently helpful.,"Mary's Organic Chicken, Chicharron Chicken & Waffle",16:50:11,4,repeated question
Q_165102_354,Diet-Appropriate Cocktails,Low-Sodium Guest,A guest is interested in non-alcoholic drink pairings for their meal.,"A low-sodium guest requests non-alcoholic drink pairings for the Iberico De Bellota Loin and Jackfruit ""Krab"" Cakes.  Considering their dietary restrictions and the menu's ingredients, which pairing is MOST appropriate?",Unsweetened iced tea with the Iberico Loin; Sparkling water with the Jackfruit Cakes.,Cranberry juice with both dishes.,Soy sauce-based marinade with the Iberico Loin;  Tomato juice with the Jackfruit Cakes.,Sweet tea with the Iberico Loin;  Orange juice with the Jackfruit Cakes.,A,"The question assesses knowledge of sodium content and allergen awareness. Option A avoids soy (allergen) and high-sodium ingredients (soy sauce, many juices).  Iced tea and sparkling water are naturally low in sodium.","Iberico De Bellota Loin, Jackfruit ""Krab"" Cakes",16:51:02,5,best
Q_165140_236,Seasonal Menu Items,No-Garlic Guest,A guest is interested in non-alcoholic drink pairings for their meal.,"A guest with a garlic allergy requests non-alcoholic drink pairings for a seasonal meal, avoiding any allium.  Which entrée and appetizer combination, along with a plausible non-alcoholic pairing suggestion, would be most suitable?","Shimane Prefecture A5 Wagyu Beef with a fruit juice (e.g., apple or cranberry juice).",Cap of Ribeye with a sparkling cider.,Umami Wagyu Beef Tartare with a ginger ale.,Shimane Prefecture A5 Wagyu Beef with Umami Wagyu Beef Tartare and a creamy soda.,A,"The question tests knowledge of allergens and menu items. Option A avoids garlic (found in the tartare) and soy (a possible allergen in some sauces).  The Shimane Wagyu is garlic-free, making it a safe choice.  A fruit juice is a safe and common non-alcoholic pairing for beef. ","Shimane Prefecture A5 Wagyu Beef, Umami Wagyu Beef Tartare, Cap of Ribeye",16:51:40,5,best
Q_165216_664,Late-Night Menu Knowledge,Sweet Tooth Guest,A guest is in town for a festival and asks for event-themed menu items.,"A guest with a sweet tooth is in town for a festival and wants a late-night meal with a sweet and savory element.  Which menu option would BEST satisfy their request, considering their preference and the limited late-night availability?","Mary's Organic Chicken, focusing on the Pickled Lingonberries for a sweet counterpoint to the savory chicken.",Chicharron Chicken & Waffle (if available late night).,Neither option would satisfy the guest's request.,"Mary's Organic Chicken, emphasizing the Burdock Puree for its unique sweetness.",A,"The question assesses knowledge of menu items and their suitability for a specific guest preference.  Option A is best because the Pickled Lingonberries offer a clear sweet element to contrast the savory chicken, aligning with the guest's sweet tooth and the late-night constraint. Option B is brunch, not late night. Option D is incorrect as Burdock Puree is not typically sweet.","Mary's Organic Chicken, Chicharron Chicken & Waffle",16:52:16,2,repeated question
Q_165247_456,Seasonal Menu Items,Shellfish Allergy Guest,A local food blogger is visiting to review the latest menu additions and seeks visually appealing plates.,"A local food blogger with a shellfish allergy is reviewing your new seasonal menu.  They want visually appealing dishes, but are allergic to shellfish. Which salad option is the safest and most visually interesting choice for them, considering the ingredients?","Beet Salad, omitting the pistachio praline.",Pacific Caesar Salad.,"Both salads, with modifications to remove all allergens.",Neither salad; suggest an alternative dish.,A,"The Pacific Caesar Salad contains smoked salmon (shellfish), making it unsafe.  The Beet Salad is a visually appealing option, and the pistachio praline can be omitted to accommodate the nut allergy.  Option C is impractical, and D doesn't address the blogger's desire for a salad.","Beet Salad, Pacific Caesar Salad",16:52:47,3,repeated question
Q_165345_419,Gluten-Free Verification,Trend-Driven Foodie,A guest is writing a review and asks the staff to share fun facts about the menu.,"A trend-driven foodie, writing a review, asks about gluten-free options and fun facts.  Which response best addresses both concerns, considering the menu and potential allergen concerns?",“Both the Crispy Tofu and Azuki Edamame Burger are naturally gluten-free.  Fun fact: our Gochujang Crema is made with fermented gochujang peppers for a unique flavor!”,“We have many gluten-free options. The Crispy Tofu is delicious! The Azuki Edamame Burger bun might contain gluten.”,“Everything is gluten-free except the burger buns.  The Crispy Tofu is our most popular dish.”,“We can modify most dishes to be gluten-free. Ask your server for details.”,A,"Option A directly addresses the guest's request for gluten-free information and fun facts, accurately stating that both mentioned items are naturally gluten-free and providing an interesting detail about the sauce. Options B, C, and D are inaccurate or incomplete regarding gluten-free options and lack the requested fun fact.","Crispy Tofu, Azuki Edamame Burger",16:53:45,4,unexpected text present in options such as'\u201c'
Q_165717_666,Dessert Ingredient Awareness,Craft Cocktail Enthusiast,A guest is interested in non-alcoholic drink pairings for their meal.,"A craft cocktail enthusiast requests non-alcoholic pairings for the Wild Mushroom Wellington.  Considering their interest in sophisticated flavors and the dish's ingredients, which dessert option would offer the most complementary and unexpected flavor profile, while also avoiding potential allergens?",A dessert featuring a subtle mushroom dashi reduction and a hint of truffle powder.,A rich chocolate lava cake with a raspberry coulis.,A classic crème brûlée.,A simple fruit tart with seasonal berries.,A,"The question assesses the staff's ability to connect a guest's preferences with menu items, considering both flavor profiles and potential allergens. Option A directly mirrors the sophisticated, umami-rich flavors of the Wild Mushroom Wellington (mushroom dashi, truffle powder) and avoids the Wellington's allergens (gluten, egg, dairy, onion). Options B, C, and D are less suitable due to flavor clashes or the presence of allergens.","Wild Mushroom Wellington, Bone Marrow",16:57:17,4,Choose different type of scenarios
Q_165836_621,Ingredient Substitution Suggestions,Food Allergy Parent,A couple on a first date seeks recommendations for shareable appetizers.,"A couple on their first date, with a child who has a severe dairy and shellfish allergy, wants shareable appetizers.  Which appetizer combination is the SAFEST option, considering the child's allergies and the desire for sharing?",Spring Vegetables and a modified portion of Dungeness Crab Mac & Cheese (hold crab and dairy),Two orders of Dungeness Crab Mac & Cheese (requesting separate preparation to avoid cross-contamination),Two orders of Spring Vegetables,One order of Dungeness Crab Mac & Cheese,C,"Option C is safest.  The child's allergies eliminate the Dungeness Crab Mac & Cheese entirely. Spring Vegetables are allergen-free, allowing safe sharing.  Options A and B risk cross-contamination or still include allergens. Option D is completely unsuitable.","Dungeness Crab Mac & Cheese, Spring Vegetables",16:58:36,4,average
Q_172302_669,Mocktail Ingredient Breakdown,Minimal Ingredient Seeker,A health-conscious diner is interested in the wellness benefits of different teas and ingredients.,A health-conscious diner seeking a minimal-ingredient mocktail with potential wellness benefits is interested in a refreshing option.  Which beverage best fits their request?,Matcha Tea,Espresso Service,"Espresso Service, modified to exclude sweeteners",Pacific Coast Mint Tea (assuming it contains only mint and water),A,"The question focuses on a health-conscious diner wanting a minimal-ingredient, refreshing mocktail.  The Matcha Tea, with its single organic ingredient, best fits this description.  The Espresso Service is complex and likely contains additional ingredients beyond those listed in its description. Option C is possible, but assumes modification, whereas A is inherently simple. Option D is speculative based on missing ingredient information.","Matcha Tea, Espresso Service, Pacific Coast Mint Tea",17:23:02,5,best
Q_172344_523,Ingredient Flavor Profiles,Seasonal Ingredient Seeker,A couple on a first date seeks recommendations for shareable appetizers.,"A couple on a first date, interested in trying seasonal ingredients, wants shareable appetizers for brunch.  Considering their potential dietary restrictions and preferences, which appetizer pairing is the LEAST suitable?","Fruitopia Pancakes (without nuts) and a side of Lardon, Hash & Eggs (adjusting for any allergies)","Two orders of Fruitopia Pancakes (one with berries, one with bananas), ensuring no nut allergy concerns","Two orders of Lardon, Hash & Eggs (adjusting for any allergies)","One order of Fruitopia Pancakes (with berries) and one order of Lardon, Hash & Eggs (adjusting for any allergies)",C,"The question assesses the suitability of appetizer pairings for a couple on a first date, considering seasonal ingredients and potential dietary restrictions. Option C is least suitable because it lacks variety and shareability, essential for a pleasant first date experience.  Options A, B, and D offer better balance and shareability,  catering to the seasonal ingredient focus and potential dietary needs.","Fruitopia Pancakes, Lardon, Hash & Eggs",17:23:44,4,Okay but can be improved
Q_172404_793,Diet-Appropriate Cocktails,Gourmet Coffee Aficionado,A couple on a first date seeks recommendations for shareable appetizers.,"A couple on their first date, one of whom is a gourmet coffee aficionado with dietary restrictions (avoiding nuts, gluten, and dairy), wants shareable brunch appetizers.  Which option best caters to their needs and preferences, considering their desire for a sophisticated experience?","Neither the Fruitopia Pancakes nor the Lardon, Hash & Eggs are suitable.","The Fruitopia Pancakes, omitting the hazelnut crumble, are a suitable option.","The Lardon, Hash & Eggs is the better option, as it avoids the allergens.","Both the Fruitopia Pancakes and Lardon, Hash & Eggs are suitable, with modifications.",A,"The question tests knowledge of menu items and allergen information.  The Fruitopia Pancakes contain nuts and dairy, and the provided information does not give enough detail on the Lardon, Hash & Eggs to know whether it is suitable. Therefore, neither dish is suitable without further clarification.","Fruitopia Pancakes, Lardon, Hash & Eggs",17:24:04,4,
Q_172525_672,Special Dietary Guest Handling,Sweet Tooth Guest,A guest is hosting a team-building lunch and wants interactive menu options.,"A guest with a sweet tooth is hosting a team-building lunch and has several team members with various dietary restrictions.  They want interactive menu options. Considering their preferences and the potential need for substitutions, which menu combination would best cater to this guest and accommodate common allergies while maintaining an element of fun and interaction?","Matcha Tea and a modified Pacific Caesar Salad (hold pecans, parmesan, and smoked salmon)",Two orders of the Pacific Caesar Salad (to share and allow for allergy adjustments),"Only the Matcha Tea, as it's the only safe option for all potential allergies.",Neither option is suitable; suggest an entirely different menu.,A,"The question tests the ability to balance guest preferences (sweet tooth) with dietary restrictions and the interactive element of a team lunch. Option A addresses the sweet tooth with Matcha Tea and modifies the salad to remove major allergens, making it suitable for many.  Options B and C are unsuitable due to either allergen concerns or lack of addressing the sweet tooth. Option D is too extreme.","Matcha Tea, Pacific Caesar Salad",17:25:25,2,"'reasoning' should contain the respective dish name instead of 'Option A, B,C,D' etc"
Q_172607_953,Dessert Ingredient Awareness,Food Allergy Parent,A local food blogger is visiting to review the latest menu additions and seeks visually appealing plates.,A food blogger with a child allergic to soy and nightshades is reviewing your new menu.  Which side dish and dessert combination is BOTH safe for the child AND visually appealing for the blog photos?,Spring Vegetables and Beet Salad (excluding the Shiso Sorbet),Spring Vegetables and Beet Salad (excluding the Pistachio Praline),Spring Vegetables and Beet Salad (full serving),None of the above are safe and visually appealing options.,A,"The Spring Vegetables are safe, excluding the Miso Celeriac puree (due to soy). The Beet Salad is mostly safe, but the Shiso Sorbet may contain nightshades; removing it makes it safe and visually appealing.","Spring Vegetables, Beet Salad",17:26:07,4,Need improvement in options
Q_172702_117,Seasonal Menu Items,Seasonal Ingredient Seeker,A vegetarian guest wants to know which items are strictly plant-based and how they are prepared.,A vegetarian guest asks about strictly plant-based options and their preparation.  Which statement accurately reflects the menu?,"The O-Toro Tataki appetizer, excluding the caviar, is plant-based and features Porcini powder, Yuzu verjus, and a tapioca-based puffed rice pillow.","Both the Fish Set and O-Toro Tataki contain plant-based components but also include animal products, making neither fully vegetarian.","The Fish Set contains several plant-based elements like the celery root puree and pickled red onion, but the fish makes it unsuitable for vegetarians.",Neither menu item offers any plant-based options.,B,"The question assesses knowledge of menu items and allergen awareness. Option B is correct because it accurately identifies that the Fish Set contains plant-based elements (purees, pickled onions) but also fish, while the O-Toro Tataki contains plant-based components but also caviar.  Therefore, neither is strictly plant-based.","Fish Set, O-Toro Tataki",17:27:02,4,Good
Q_172728_538,Vegan Ingredient Awareness,Seasonal Ingredient Seeker,A returning customer asks if there are any new menu items since their last visit.,"A returning customer, who is a seasonal ingredient seeker and follows a vegan diet, asks about new brunch items.  Which response best addresses their inquiry, considering their dietary needs and interest in seasonal ingredients?","We have the Fruitopia Pancakes, but please note they contain nuts, gluten, dairy, and eggs, so they are not vegan. We do not currently offer any new vegan brunch options.",Yes! We've added a new vegan quiche with seasonal vegetables.  It's delicious!,"We've added several new brunch items, including the Lardon, Hash & Eggs. Would you like to hear more about our full menu?","Our menu hasn't changed much.  We have the Fruitopia Pancakes, which are very popular.",A,"The question focuses on a vegan, seasonal ingredient-seeking returning customer. Option A directly addresses the customer's dietary restrictions and the lack of vegan options while acknowledging the existing (non-vegan) menu item. Options B and C are incorrect as they don't consider the customer's vegan restrictions. Option D is incomplete, failing to address the 'new items' aspect.","Fruitopia Pancakes, Lardon, Hash & Eggs",17:27:28,2,very basic question
Q_172807_639,Cultural Dining Etiquette,Experimental Foodie,A guest is observing a religious dietary restriction and asks for suitable options.,"An experimental foodie observing Kosher dietary laws expresses interest in brunch.  Considering their restrictions and preferences, which menu item is MOST suitable, assuming all other ingredients are Kosher-compliant except for those listed as allergens?",Avocado Crostino (excluding chili relish and shichimi togarashi),Avocado Crostino (as is),Spicy Citrus Avocado Roll,Neither option is suitable.,A,"The question tests knowledge of dietary restrictions and menu item composition.  Option A is correct because it removes the only potential non-Kosher ingredients (chili relish often contains vinegar made from wine, and shichimi togarashi frequently contains sesame). The Spicy Citrus Avocado Roll contains soy, a common allergen and potential non-Kosher ingredient. The question assesses the ability to adapt menu offerings to meet specific dietary needs.","Avocado Crostino, Spicy Citrus Avocado Roll",17:28:07,3,Need improvement in quality of question
Q_173620_717,Ingredient Pairing Logic,Gluten-Free Guest,A diner requests a custom beverage that is not on the menu.,"A gluten-free guest requests a custom beverage to pair with the Iberico De Bellota Loin, avoiding anything with graham cracker notes due to cross-contamination concerns.  Which of the following is the BEST suggestion, considering the Espresso Service description and the appetizer's ingredients?","Recommend the Espresso Service, emphasizing the black cherry and Meyer lemon notes to complement the Yuzu soy marinade and cut through the richness of the Iberico.","Suggest a glass of water, explaining that the Espresso Service's graham cracker notes would clash with the Iberico.","Offer a different coffee without specifying the reason, to avoid further inquiry.",Inform the guest that the Espresso Service is the only coffee option and that they should choose something else from the menu.,A,"Option A best addresses the guest's needs.  It focuses on the complementary flavor profiles (citrus from both the beverage and marinade) while acknowledging the gluten-free restriction by omitting the graham cracker aspect. Options B, C, and D are inadequate responses to a custom request and fail to offer a suitable alternative.","Espresso Service, Iberico De Bellota Loin",17:36:20,3,
Q_174034_421,Seasonal Menu Items,Experimental Foodie,A guest with a shellfish allergy is concerned about potential cross-contact.,An experimental foodie with a shellfish allergy wants a safe and exciting meal.  Which menu combination minimizes cross-contact risk and best suits their adventurous palate?,Fish Set (requesting no black garlic puree) and O-Toro Tataki (omitting caviar),Fish Set and O-Toro Tataki (as is),Only the Fish Set,Only the O-Toro Tataki,A,"The Fish Set contains garlic and onion, potential cross-contaminants with shellfish.  Omitting the black garlic puree minimizes this risk. The O-Toro Tataki contains caviar, a shellfish derivative; omitting it ensures allergy safety.  Option A provides the best balance of minimizing risk and satisfying an adventurous palate.","Fish Set, O-Toro Tataki",17:40:34,5,Best
Q_174227_736,Late-Night Menu Knowledge,Experimental Foodie,A guest is lactose intolerant and asks for dairy-free dessert options.,"An experimental foodie, lactose intolerant, arrives late and wants a unique dairy-free dessert pairing.  Which option best caters to their preferences, considering menu limitations?",Suggest the Caviar with a side of Dungeness Crab Mac & Cheese (modified to omit dairy),"Recommend the Caviar alone, explaining there are no other dairy-free dessert options.","Offer the Dungeness Crab Mac & Cheese (dairy-free modification), mentioning it's a savory option.",Suggest the Kaluga Caviar with a side of plain macaroni (without the sauce).,A,"The Caviar offers a luxurious, experimental experience.  Modifying the Dungeness Crab Mac & Cheese to remove dairy provides a unique savory-rich pairing suitable for a late-night, adventurous palate.","Dungeness Crab Mac & Cheese, Caviar",17:42:27,5,Best
Q_174257_271,Chef’s Special Knowledge,Nordic Cuisine Seeker,A returning customer asks if there are any new menu items since their last visit.,"A returning customer, familiar with Nordic cuisine, asks about new menu items.  Which recommendation best caters to their preference while acknowledging their potential allergies and desire for both familiar and adventurous flavors?","Highlight the Smoked Venison Tenderloin, emphasizing the Koji and Miso Celeriac Puree for a unique Nordic twist, while cautioning about the dairy and soy allergens.","Suggest the Jackfruit ""Krab"" Cakes, emphasizing the vegan aspect and the interesting flavor combinations.","Recommend both the Venison and the Jackfruit Cakes, assuring them both are new additions.","Suggest neither, explaining that no new Nordic-inspired dishes have been added.",A,"The Smoked Venison Tenderloin offers a unique Nordic-inspired dish with familiar elements (venison) and adventurous flavors (Koji, Miso Celeriac Puree). The allergy warning addresses the customer's potential dietary restrictions.","Smoked Venison Tenderloin, Jackfruit ""Krab"" Cakes",17:42:57,5,Best
