id,scenario,persona,additional_context,question,option_a,option_b,option_c,option_d,correct_answer,reasoning,menu_items_referenced,created_at,rating,feedback_notes
Q_174325_899,Dessert Allergy Awareness,Chocolate Aficionado,A guest is gluten-intolerant but wants to try a signature pastry—asks for alternatives.,"A chocolate-loving guest, who is gluten-intolerant, wants a decadent dessert experience.  Which dessert option best balances their dietary needs with their love for rich flavors, considering available alternatives?","Suggest a modified version of the Chill dessert, replacing the toasted coconut with additional Yuzu Dragon Fruit for a unique, rich flavor profile.","Recommend the Halo dessert, assuring them that the mango curd is dairy-free and gluten-free.","Offer them the Skyfall dessert with a disclaimer that it contains gluten, despite being chocolate-flavored.","Inform them that unfortunately, there are no suitable gluten-free options that cater to their chocolate preference.",A,"The Chill dessert's ingredients offer a potential for a rich, flavorful alternative by focusing on the Yuzu Dragon Fruit to enhance the intensity, while accommodating the gluten restriction.  Options B and D are incorrect as Halo contains gluten and option C is incorrect as it contradicts the guest's dietary needs. ","Chill, Halo, Skyfall",17:43:25,5,Good
Q_174420_827,Food and Wine Event Knowledge,Allergy-Conscious Guest,A guest wants a recommendation for a “hidden gem” on the menu.,"An allergy-conscious guest at the Food and Wine event requests a 'hidden gem' happy hour menu item, avoiding gluten, soy, and egg. Which option best fits their needs, considering their dietary restrictions and desire for something unique?",No recommendation can be made from the Happy Hour menu due to the guest's allergies.,"The Wagyu Beef Cheek Bao Sliders are a suitable choice, as the description doesn't explicitly mention egg.",The Wagyu Beef Cheek Bao Sliders are a safe option if the guest is willing to risk a potential cross-contamination.,More information is needed to determine a suitable option from the Happy Hour menu.,A,"The Wagyu Beef Cheek Bao Sliders contain gluten, soy, and egg, making them unsuitable for the guest.  Therefore, no suitable recommendation can be made from the provided Happy Hour menu.",Wagyu Beef Cheek Bao Sliders,17:44:20,5,Best
Q_174448_603,Ingredient Knowledge,Sustainable Diner,A health-conscious diner is interested in the wellness benefits of different teas and ingredients.,"A health-conscious diner wants a vegetarian dish highlighting wellness benefits. They are particularly interested in the potential health benefits of different teas (not listed on the menu) and are avoiding soy. Which menu option is the most suitable, considering their dietary restrictions and interest in wellness, and why?",Roasted Cauliflower Steak,Crispy Tofu,Roasted Cauliflower Steak and Crispy Tofu (a combination),"None of the above, as no option meets the criteria.",A,"Roasted Cauliflower Steak is the only option that does not contain soy, addressing the diner's dietary restriction. While the specific tea benefits are not directly on the menu, cauliflower is known for its nutritional value, making it the most suitable choice.","Roasted Cauliflower Steak, Crispy Tofu",17:44:48,4,Good
Q_174524_279,Dessert Pairing,Gourmet Coffee Aficionado,A first-time customer is curious about the origins and stories behind each menu item.,"A gourmet coffee aficionado, new to the restaurant, orders the Caramelized Pear Tea.  They are fascinated by the origins of the ingredients and want a complementary tea to compare. Which tea, considering its profile and the customer's interest in origin stories, would be the BEST second choice?",Matcha Tea,Pacific Coast Mint Tea,Another Caramelized Pear Tea,"None, they should order coffee instead.",A,"Matcha Tea, with its focus on organic ceremonial grade matcha, offers a story of origin and a contrasting flavor profile (light and refreshing) compared to the fruity sweetness of Caramelized Pear Tea.  This allows for a comparative tasting experience aligning with the customer's interest.","Caramelized Pear Tea, Matcha Tea, Pacific Coast Mint Tea",17:45:24,5,Best
Q_174558_573,Ingredient Allergy Identification,Mushroom Allergy Guest,A guest requests help with food allergies for their child’s school form.,A guest needs help filling out their child's school allergy form.  The child has a mushroom allergy. Which menu item(s) are completely safe for the child?,Vegetarian Beet Salad only,Wild Mushroom Wellington only,Both the Vegetarian Beet Salad and the Wild Mushroom Wellington,Neither the Vegetarian Beet Salad nor the Wild Mushroom Wellington,A,"The Vegetarian Beet Salad contains no mushrooms. The Wild Mushroom Wellington contains several types of mushrooms, making it unsafe.","Vegetarian Beet Salad, Wild Mushroom Wellington",17:45:58,4,Good
Q_175245_619,Culinary Technique Awareness,Michelin Star Tourist,A guest asks for the chef’s personal favorite menu item and why.,"A Michelin-star tourist asks for the chef's favorite menu item, citing their appreciation for both refined Wagyu preparations and dishes showcasing complex flavor profiles.  Considering the guest's potential allergies (soy and allium), which item would be the MOST likely recommendation, and why?",Umami Wagyu Beef Tartare,Shimane Prefecture A5 Wagyu Beef,Cap of Ribeye,"Any item, as the chef's preference is subjective.",A,"The Umami Wagyu Beef Tartare avoids the guest's soy and allium allergies.  It also offers a complex flavor profile with various ingredients beyond the Wagyu itself, making it a more likely choice to impress a Michelin-star diner than the other Wagyu options.","Umami Wagyu Beef Tartare, Shimane Prefecture A5 Wagyu Beef, Cap of Ribeye",17:52:45,5,Good
Q_175313_674,Late-Night Menu Knowledge,Dairy-Free Dessert Seeker,A guest asks for the chef’s personal favorite menu item and why.,"A dairy-free guest asks for the chef's favorite late-night menu item and reasoning.  What's the best response, considering the menu and their dietary restriction?","I'd recommend the Iridori American Wagyu Dry Aged Ribeye; the chef loves the rich flavor profile, though it contains soy.","The chef's favorite is the Skyfall, but unfortunately, it's not dairy-free due to the goat cheese.","The chef loves both the ribeye and Skyfall equally, but neither accommodates dairy-free needs.",Both the ribeye and Skyfall are chef's favorites; I can suggest an alternative dairy-free option not on the menu.,A,"The question asks for the chef's favorite, acknowledging the dairy-free restriction. While the Skyfall is unsuitable, the Iridori Ribeye is a valid suggestion, despite containing soy.","Iridori American Wagyu Dry Aged Ribeye, Skyfall",17:53:13,5,best
